{
  "$schema": "https://json-schema.org/draft/2020-12/schema",
  "$id": "https://decisiontrees-aicft-assessor/validation.schema.json",
  "title": "Technical Validation Artifact Schema 3.0",
  "type": "object",
  "required": [
    "stage",
    "worksheet",
    "student_id",
    "parse_success",
    "blocked"
  ],
  "additionalProperties": false,
  "properties": {
    "stage": {
      "const": "validation"
    },
    "worksheet": {
      "$ref": "common.schema.json#/$defs/worksheet_id"
    },
    "student_id": {
      "type": "string"
    },
    "updated_at": {
      "type": "string"
    },
    "ocr_quality": {
      "type": [
        "number",
        "null"
      ]
    },
    "parse_success": {
      "type": "boolean"
    },
    "formula_parsed": {
      "type": "boolean"
    },
    "tree_detected": {
      "type": [
        "boolean",
        "null"
      ]
    },
    "missing_regions": {
      "type": "array",
      "items": {
        "type": "string"
      }
    },
    "deterministic_checks": {
      "type": "object"
    },
    "blocked": {
      "type": "boolean"
    },
    "blocked_reason": {
      "type": [
        "string",
        "null"
      ]
    },
    "mcr": {
      "type": "object"
    },
    "ws6_path_specs": {
      "type": "array"
    },
    "sample_tree_reference": {
      "type": "string"
    },
    "all_correct": {
      "type": "boolean"
    },
    "reference": {
      "type": "string"
    },
    "ocr_normalization": {
      "type": "array"
    },
    "validation_error": {
      "type": "string"
    },
    "htr_status": {
      "type": "string"
    },
    "table_rows_captured": {
      "type": "integer",
      "minimum": 0
    }
  }
}
